{
  "learningSourceRef": "rc10-swarm-experience-learning-source-read-context-failure-20261003-01",
  "workspaceRef": "private-workspace:SWARM-EXP-20261003",
  "missionRef": "private-mission:SWARM-EXP-20261003-02",
  "closureSummaryRef": "validation/rc10/swarm-engineering-learning-20261003/OBSERVATIONS.md#episode-02--context-specific-read-failure",
  "subjectRefs": [
    "swarm-experience:rc10wk-swarm-read-context-failure-20261003-01",
    "source-snapshot:88002deacc71d041999499680645e9ffb73f0504"
  ],
  "sourceRefs": [
    "private-evidence:SWARM-EXP-20261003-02",
    "engcim/bootstrap/multica/MAPPING.md",
    "https://github.com/multica-ai/multica/issues/368",
    "https://github.com/multica-ai/multica/pull/796"
  ],
  "evidenceRefs": [
    "validation/rc10/swarm-engineering-learning-20261003/OBSERVATIONS.md#episode-02--context-specific-read-failure",
    "private-evidence:SWARM-EXP-20261003-02",
    "engcim/bootstrap/multica/MAPPING.md",
    "https://github.com/multica-ai/multica/issues/368",
    "https://github.com/multica-ai/multica/pull/796"
  ]
}
